{
  "schema": "changerail.delivery-run.v1",
  "run_id": "example-blocked",
  "updated_at": "2026-08-09T00:00:00Z",
  "workspace": {
    "root": "/opt/changerail",
    "head_commit": "example-head"
  },
  "card": {
    "id": "example-card",
    "path": "openspec/board/3.inprogress/example-card.md"
  },
  "phase": "terminal",
  "result": "BLOCKED",
  "timestamps": {
    "started_at": "2026-08-09T00:00:00Z",
    "ended_at": "2026-08-09T00:01:00Z"
  },
  "command": {
    "argv": [
      "bin/changerail-delivery-runner",
      "run",
      "openspec/board/3.inprogress/example-card.md"
    ],
    "launcher": "bin/changerail-delivery-runner",
    "stdin": "closed",
    "json": true
  },
  "terminal_outcome": "BLOCKED",
  "terminal_reason": "fix_budget_exhausted",
  "logs": {
    "stdout": ".runtime/changerail/delivery-runs/example-blocked/stdout.jsonl"
  },
  "usage": {
    "available": false,
    "reason": "fixture"
  }
}
